{"$schema":"https://json-schema.org/draft/2020-12/schema","additionalProperties":false,"properties":{"allocations":{"items":{"additionalProperties":false,"properties":{"contributors":{"items":{"additionalProperties":false,"properties":{"child_id":{"pattern":"^S[1-9][0-9]{0,5}$","type":"string"},"criterion_id":{"pattern":"^C[1-9][0-9]{0,5}$","type":"string"},"role":{"enum":["full","partial","preservation"]}},"required":["child_id","criterion_id","role"],"type":"object"},"maxItems":64,"minItems":0,"type":"array"},"parent_check_ids":{"items":{"pattern":"^I[1-9][0-9]{0,5}$","type":"string"},"maxItems":256,"minItems":1,"type":"array"},"parent_only_reason":{"anyOf":[{"maxLength":4096,"minLength":1,"type":"string"},{"type":"null"}]},"parent_requirement_id":{"pattern":"^R[1-9][0-9]{0,5}$","type":"string"}},"required":["parent_requirement_id","contributors","parent_check_ids","parent_only_reason"],"type":"object"},"maxItems":256,"minItems":0,"type":"array"},"children":{"items":{"additionalProperties":false,"properties":{"id":{"pattern":"^S[1-9][0-9]{0,5}$","type":"string"},"inheritance":{"const":"all_parent_constraints_and_exclusions"},"kind":{"enum":["outcome","enabling"]},"outcome":{"maxLength":4096,"minLength":1,"type":"string"},"requirements":{"items":{"additionalProperties":false,"properties":{"boundaries":{"items":{"maxLength":4096,"minLength":1,"type":"string"},"maxItems":256,"minItems":0,"type":"array"},"contribution":{"maxLength":4096,"minLength":1,"type":"string"},"gap_reason":{"anyOf":[{"maxLength":4096,"minLength":1,"type":"string"},{"type":"null"}]},"id":{"pattern":"^C[1-9][0-9]{0,5}$","type":"string"},"oracle":{"maxLength":4096,"minLength":1,"type":"string"},"parent_requirement_ids":{"items":{"pattern":"^R[1-9][0-9]{0,5}$","type":"string"},"maxItems":256,"minItems":1,"type":"array"},"plan_state":{"enum":["planned","gap"]},"planned_evidence":{"maxLength":4096,"minLength":1,"type":"string"},"seam":{"maxLength":4096,"minLength":1,"type":"string"},"source_refs":{"items":{"additionalProperties":false,"properties":{"line_end":{"maximum":999999,"minimum":1,"type":"integer"},"line_start":{"maximum":999999,"minimum":1,"type":"integer"},"quote":{"maxLength":4096,"minLength":1,"type":"string"},"source_id":{"pattern":"^S[1-9][0-9]{0,5}$","type":"string"}},"required":["source_id","line_start","line_end","quote"],"type":"object"},"maxItems":64,"minItems":1,"type":"array"}},"required":["id","parent_requirement_ids","contribution","boundaries","seam","oracle","planned_evidence","plan_state","gap_reason","source_refs"],"type":"object"},"maxItems":256,"minItems":1,"type":"array"}},"required":["id","outcome","kind","inheritance","requirements"],"type":"object"},"maxItems":8,"minItems":0,"type":"array"},"decision":{"enum":["no_split","split"]},"parent":{"additionalProperties":false,"properties":{"continuity_sha256":{"anyOf":[{"pattern":"^[0-9a-f]{64}$","type":"string"},{"type":"null"}]},"contract_id":{"pattern":"^[a-z0-9][a-z0-9-]{0,79}$","type":"string"},"contract_sha256":{"pattern":"^[0-9a-f]{64}$","type":"string"},"revision":{"maximum":999999,"minimum":1,"type":"integer"},"source_bundle_sha256":{"pattern":"^[0-9a-f]{64}$","type":"string"},"source_chain_sha256":{"pattern":"^[0-9a-f]{64}$","type":"string"}},"required":["contract_id","revision","contract_sha256","source_bundle_sha256","source_chain_sha256","continuity_sha256"],"type":"object"},"parent_final_checks":{"items":{"additionalProperties":false,"properties":{"id":{"pattern":"^I[1-9][0-9]{0,5}$","type":"string"},"observable":{"maxLength":4096,"minLength":1,"type":"string"},"oracle":{"maxLength":4096,"minLength":1,"type":"string"},"owner":{"maxLength":4096,"minLength":1,"type":"string"},"parent_requirement_ids":{"items":{"pattern":"^R[1-9][0-9]{0,5}$","type":"string"},"maxItems":256,"minItems":1,"type":"array"},"planned_evidence":{"maxLength":4096,"minLength":1,"type":"string"},"source_refs":{"items":{"additionalProperties":false,"properties":{"line_end":{"maximum":999999,"minimum":1,"type":"integer"},"line_start":{"maximum":999999,"minimum":1,"type":"integer"},"quote":{"maxLength":4096,"minLength":1,"type":"string"},"source_id":{"pattern":"^S[1-9][0-9]{0,5}$","type":"string"}},"required":["source_id","line_start","line_end","quote"],"type":"object"},"maxItems":64,"minItems":1,"type":"array"}},"required":["id","parent_requirement_ids","owner","observable","oracle","planned_evidence","source_refs"],"type":"object"},"maxItems":256,"minItems":0,"type":"array"},"prerequisites":{"items":{"additionalProperties":false,"properties":{"child_id":{"pattern":"^S[1-9][0-9]{0,5}$","type":"string"},"reason":{"maxLength":4096,"minLength":1,"type":"string"},"required_outcome":{"maxLength":4096,"minLength":1,"type":"string"},"requires_child_id":{"pattern":"^S[1-9][0-9]{0,5}$","type":"string"},"source_refs":{"items":{"additionalProperties":false,"properties":{"line_end":{"maximum":999999,"minimum":1,"type":"integer"},"line_start":{"maximum":999999,"minimum":1,"type":"integer"},"quote":{"maxLength":4096,"minLength":1,"type":"string"},"source_id":{"pattern":"^S[1-9][0-9]{0,5}$","type":"string"}},"required":["source_id","line_start","line_end","quote"],"type":"object"},"maxItems":64,"minItems":1,"type":"array"}},"required":["child_id","requires_child_id","required_outcome","reason","source_refs"],"type":"object"},"maxItems":56,"minItems":0,"type":"array"},"rationale":{"additionalProperties":false,"properties":{"basis":{"const":"advisory_plan_not_proof"},"next_action":{"maxLength":4096,"minLength":1,"type":"string"},"source_refs":{"items":{"additionalProperties":false,"properties":{"line_end":{"maximum":999999,"minimum":1,"type":"integer"},"line_start":{"maximum":999999,"minimum":1,"type":"integer"},"quote":{"maxLength":4096,"minLength":1,"type":"string"},"source_id":{"pattern":"^S[1-9][0-9]{0,5}$","type":"string"}},"required":["source_id","line_start","line_end","quote"],"type":"object"},"maxItems":64,"minItems":1,"type":"array"},"uncertainties":{"items":{"maxLength":4096,"minLength":1,"type":"string"},"maxItems":256,"minItems":0,"type":"array"},"why_not_one_delivery":{"maxLength":4096,"minLength":1,"type":"string"},"why_these_boundaries":{"maxLength":4096,"minLength":1,"type":"string"}},"required":["why_not_one_delivery","why_these_boundaries","basis","source_refs","uncertainties","next_action"],"type":"object"},"record":{"const":"intentline.slicing"},"schema_version":{"const":1},"supersedes_sha256":{"anyOf":[{"pattern":"^[0-9a-f]{64}$","type":"string"},{"type":"null"}]}},"required":["record","schema_version","parent","decision","rationale","children","allocations","prerequisites","parent_final_checks","supersedes_sha256"],"type":"object"}
