{"allocations":[],"children":[],"decision":"no_split","parent":{"continuity_sha256":null,"contract_id":"portable-input-boundary","contract_sha256":"BIND_CURRENT_PARENT","revision":1,"source_bundle_sha256":"BIND_CURRENT_SOURCES","source_chain_sha256":"BIND_CURRENT_CHAIN"},"parent_final_checks":[],"prerequisites":[],"rationale":{"basis":"advisory_plan_not_proof","next_action":"Continue with the complete parent agreement","source_refs":[{"line_end":1,"line_start":1,"quote":"1. Add `export --format proofline-native`; preserve existing `proofline-direct`, `markdown`, and `json` byte/behavior contracts. Native export is a **candidate input bundle**, not authorization or proof. It may be inspected while unapproved, but its manifest must explicitly say `authorization: not_established`; only a separately trusted caller can authorize native delivery. The manifest contains contract JSON, exact original request and every amendment byte stream, all binding context, source/contract/successor/continuity identities, current requirements and constraints, open decisions/evidence gaps, advisory audit and adoption provenance, and a hash for every included file. A complete marker is written last.","source_id":"S1"}],"uncertainties":[],"why_not_one_delivery":"One coherent public validation outcome fits direct delivery","why_these_boundaries":"No independently useful delivery boundary"},"record":"intentline.slicing","schema_version":1,"supersedes_sha256":null}
