{"allocations":[{"contributors":[{"child_id":"S1","criterion_id":"C1","role":"full"}],"parent_check_ids":["I1"],"parent_only_reason":null,"parent_requirement_id":"R1"},{"contributors":[{"child_id":"S2","criterion_id":"C1","role":"full"}],"parent_check_ids":["I2"],"parent_only_reason":null,"parent_requirement_id":"R2"}],"children":[{"id":"S1","inheritance":"all_parent_constraints_and_exclusions","kind":"outcome","outcome":"Reject empty and whitespace-only usernames","requirements":[{"boundaries":["empty","spaces","tabs"],"contribution":"Reject empty and whitespace-only usernames","gap_reason":null,"id":"C1","oracle":"validation error for empty/whitespace-only usernames","parent_requirement_ids":["R1"],"plan_state":"planned","planned_evidence":"call interface with empty, spaces, and tabs","seam":"public validation interface","source_refs":[{"line_end":1,"line_start":1,"quote":"Reject empty and whitespace-only usernames","source_id":"S1"}]}]},{"id":"S2","inheritance":"all_parent_constraints_and_exclusions","kind":"outcome","outcome":"Keep valid usernames unchanged","requirements":[{"boundaries":["valid username"],"contribution":"Keep valid usernames unchanged","gap_reason":null,"id":"C1","oracle":"Exact valid username retained","parent_requirement_ids":["R2"],"plan_state":"planned","planned_evidence":"Observe public validation with a valid username","seam":"public validation interface","source_refs":[{"line_end":2,"line_start":2,"quote":"Keep valid usernames unchanged","source_id":"S1"}]}]}],"decision":"split","parent":{"continuity_sha256":null,"contract_id":"username-validation","contract_sha256":"983effa47fd79dbefd9e26814af7affc661caaa1d0c1dd2bbe3e4f30c255861b","revision":1,"source_bundle_sha256":"15df00ccc974cf497ccf4ca74c4166972c39d45033be089387fecc6f0a262c9a","source_chain_sha256":"5937cd28651bd76ba49dd1fe0081fbf640e412c3ae2dca53d18f6e4f6cd86f07"},"parent_final_checks":[{"id":"I1","observable":"Reject empty and whitespace-only usernames","oracle":"validation error for empty/whitespace-only usernames","owner":"Future assembled-product verifier","parent_requirement_ids":["R1"],"planned_evidence":"Observe one assembled public candidate including negative cases","source_refs":[{"line_end":1,"line_start":1,"quote":"Reject empty and whitespace-only usernames","source_id":"S1"}]},{"id":"I2","observable":"Keep valid usernames unchanged","oracle":"Exact valid username retained","owner":"Future assembled-product verifier","parent_requirement_ids":["R2"],"planned_evidence":"Observe one assembled public candidate including negative cases","source_refs":[{"line_end":2,"line_start":2,"quote":"Keep valid usernames unchanged","source_id":"S1"}]}],"prerequisites":[],"rationale":{"basis":"advisory_plan_not_proof","next_action":"Continue with the complete parent agreement","source_refs":[{"line_end":1,"line_start":1,"quote":"Reject empty and whitespace-only usernames","source_id":"S1"}],"uncertainties":[],"why_not_one_delivery":"Public interface must remain compatible while validation changes","why_these_boundaries":"Observe compatibility separately before the rejecting transition; merging loses the staged checkpoint"},"record":"intentline.slicing","schema_version":1,"supersedes_sha256":null}
